{
  "schemaVersion": 1,
  "kind": "engineering-process-protected-transition-policy",
  "project": "engineering-process",
  "repository": "phuongnse/engineering-process",
  "sourceAuthority": {
    "version": "0.7.0",
    "digest": "sha256:24f2502506d1445d7c71096f39bdf72dee8c36d49cc606df059fb44ef6885ae4"
  },
  "target": {
    "version": "0.9.0",
    "tag": "v0.9.0",
    "commit": "b32cb88f7d25a70ee2aff64ec1605022dfd0b462",
    "processDigest": "sha256:07ebb8c411aa97af6ee3e0761e143d91d368f183ea24f0f83e56f1930d724bcf"
  },
  "intentPath": ".process/bootstrap-adoptions/0.9.0.json",
  "verifier": {
    "repository": "phuongnse/engineering-process",
    "commit": "0544581f548edcd62e646457964a9dafc8e8164f",
    "entrypoint": "verification/validate_authority_transition.py"
  },
  "workflow": {
    "repository": "phuongnse/engineering-process",
    "path": ".github/workflows/authority-transition.yml",
    "checkContext": "authority-transition-completion",
    "checkAppId": 4667609,
    "consumptionContext": "authority-transition-consumption"
  },
  "merge": {
    "method": "protected-auto-merge",
    "requireCurrentBase": true,
    "requireExactHead": true,
    "requireRequiredChecks": true
  },
  "authorizationTransport": {
    "kind": "host-callback-gzip-base64",
    "evidenceKind": "bootstrap-authorization",
    "maxEncodedBytes": 60000
  },
  "singleUse": true,
  "postMergeMutation": false,
  "expiresAt": "2026-09-30T00:00:00Z"
}
